epoch	commit	baseline_commit	official_median_sps	median_pair_ratio	ci95_low	ci95_high	candidate_faster_pairs	measured_pairs	status	description	artifact
0	86a3a5f	-	46403.7640328575	1.0	46334.02575562683	46414.311465368744	-	11	baseline	fresh full-official beast-3 host baseline after benchmark state-dir fix	artifacts/benchmarks/host-results/host-single-2026-07-02-200958-R86a3a5f4602f/aggregate.json
1	7022553	86a3a5f	48570.76297903061	1.0525804254262712	1.0487970667130555	1.0600049333144261	11	11	keep	fast-forward SMB sprite-0 polling loop	artifacts/benchmarks/host-results/host-compare-2026-07-02-202650-B86a3a5f4602f-C702255342113/aggregate.json
2	d546564	7022553	45614.68954807923	0.9419859635865181	0.9392962361088418	0.9432440777348456	0	11	discard	fast-forward SMB controller polling loop	artifacts/benchmarks/host-results/host-compare-2026-07-02-210407-B702255342113-Cd546564be8c5/aggregate.json
3	ef959e1	7022553	48251.97912006141	0.993356136665428	0.9910008932257317	0.9986968827492797	1	11	discard	combine background sprite priority lookup	artifacts/benchmarks/host-results/host-compare-2026-07-02-213419-B702255342113-Cef959e1f9b2d/aggregate.json
4	a262398	7022553	50193.76276594203	1.0352329816719152	1.0306466330220425	1.0369758374516294	11	11	discard	fast-forward SMB OAM clear helper	artifacts/benchmarks/host-results/host-compare-2026-07-02-220902-B702255342113-Ca262398ee7d6/aggregate.json
5	1c2178d	33c273d	50072.88743126594	1.0821469471532668	1.080402979603871	1.0859394974851821	21	21	keep	combined sprite-0 polling plus OAM clear helper versus main	artifacts/benchmarks/host-results/host-compare-2026-07-03-102429-B33c273d4ef30-C1c2178db0ca3/aggregate.json
